<?xml version="1.0" encoding="UTF-8"?>
<!DOCTYPE MODEL SYSTEM 'delta/leo/model/io/xml/Model.dtd'>
<MODEL NAME="GENEA">
	<ENTITY NAME="PERSONNE">
		<FIELD NAME="NOM">
			<PROPERTIES MANDATORY="false" ID="false" NAME="true"/>
			<TYPE CLASS="STRING">
				<PARAM NAME="MIN_LENGTH" VALUE="0" />
				<PARAM NAME="MAX_LENGTH" VALUE="32" />
				<PARAM NAME="MULTILINES" VALUE="false" />
			</TYPE>
		</FIELD>
		<FIELD NAME="PRENOMS">
			<PROPERTIES MANDATORY="false" ID="false" NAME="true"/>
			<TYPE CLASS="STRING">
				<PARAM NAME="MIN_LENGTH" VALUE="0" />
				<PARAM NAME="MAX_LENGTH" VALUE="64" />
				<PARAM NAME="MULTILINES" VALUE="false" />
			</TYPE>
		</FIELD>
		<FIELD NAME="SIGNATURE">
			<PROPERTIES MANDATORY="false" ID="false" NAME="false"/>
			<TYPE CLASS="STRING">
				<PARAM NAME="MIN_LENGTH" VALUE="1" />
				<PARAM NAME="MAX_LENGTH" VALUE="1" />
				<PARAM NAME="MULTILINES" VALUE="false" />
			</TYPE>
		</FIELD>
		<FIELD NAME="NAISSANCE">
			<PROPERTIES MANDATORY="false" ID="false" NAME="false"/>
			<TYPE CLASS="DATE" />
		</FIELD>
		<FIELD NAME="INFOS_NAISSANCE">
			<PROPERTIES MANDATORY="false" ID="false" NAME="false"/>
			<TYPE CLASS="STRING">
				<PARAM NAME="MIN_LENGTH" VALUE="0" />
				<PARAM NAME="MAX_LENGTH" VALUE="1000" />
				<PARAM NAME="MULTILINES" VALUE="true" />
			</TYPE>
		</FIELD>
		<FIELD NAME="DECES">
			<PROPERTIES MANDATORY="false" ID="false" NAME="false"/>
			<TYPE CLASS="DATE" />
		</FIELD>
		<FIELD NAME="INFOS_DECES">
			<PROPERTIES MANDATORY="false" ID="false" NAME="false"/>
			<TYPE CLASS="STRING">
				<PARAM NAME="MIN_LENGTH" VALUE="0" />
				<PARAM NAME="MAX_LENGTH" VALUE="1000" />
				<PARAM NAME="MULTILINES" VALUE="true" />
			</TYPE>
		</FIELD>
		<FIELD NAME="COMMENTAIRE">
			<PROPERTIES MANDATORY="false" ID="false" NAME="false"/>
			<TYPE CLASS="STRING">
				<PARAM NAME="MIN_LENGTH" VALUE="0" />
				<PARAM NAME="MAX_LENGTH" VALUE="1000" />
				<PARAM NAME="MULTILINES" VALUE="true" />
			</TYPE>
		</FIELD>
	</ENTITY>
	<ENTITY NAME="ACTE">
	</ENTITY>
	<ENTITY NAME="LIEU">
	</ENTITY>
	<ENTITY NAME="PREUVE">
	</ENTITY>
	<ENTITY NAME="RECHERCHE">
	</ENTITY>
	<ENTITY NAME="COUSINAGE">
	</ENTITY>
	<ENTITY NAME="COUSIN">
	</ENTITY>
	<BINARY_ASSOCIATION NAME="LIEUX">
		<A ENTITY_NAME="LIEU" ROLE="LIEU_ENGLOBE"/>
		<B ENTITY_NAME="LIEU" ROLE="LIEU_ENGLOBANT"/>
		<AtoB MIN="0" MAX="1" TRAVERSABLE="true" MEANING="LIEU_PARENT"/>
		<BtoA MIN="0" MAX="INFINITY" ORDERED="false" TRAVERSABLE="false" MEANING=""/>
	</BINARY_ASSOCIATION>
	<BINARY_ASSOCIATION NAME="ENFANT/PERE">
		<A ENTITY_NAME="PERSONNE" ROLE="ENFANT"/>
		<B ENTITY_NAME="PERSONNE" ROLE="PERE"/>
		<AtoB MIN="0" MAX="1" TRAVERSABLE="true" MEANING="EST ENFANT DE"/>
		<BtoA MIN="0" MAX="INFINITY" ORDERED="true" TRAVERSABLE="false" MEANING="EST LE PERE DE"/>
	</BINARY_ASSOCIATION>
	<BINARY_ASSOCIATION NAME="ENFANT/MERE">
		<A ENTITY_NAME="PERSONNE" ROLE="ENFANT"/>
		<B ENTITY_NAME="PERSONNE" ROLE="MERE"/>
		<AtoB MIN="0" MAX="1" TRAVERSABLE="true" MEANING="EST ENFANT DE"/>
		<BtoA MIN="0" MAX="INFINITY" ORDERED="true" TRAVERSABLE="false" MEANING="EST LA MERE DE"/>
	</BINARY_ASSOCIATION>
	<BINARY_ASSOCIATION NAME="ENFANT/PARRAIN">
		<A ENTITY_NAME="PERSONNE" ROLE="ENFANT"/>
		<B ENTITY_NAME="PERSONNE" ROLE="PARRAIN"/>
		<AtoB MIN="0" MAX="1" TRAVERSABLE="true" MEANING="PARRAIN"/>
		<BtoA MIN="0" MAX="INFINITY" ORDERED="true" TRAVERSABLE="false" MEANING="EST LE PARRAIN DE"/>
	</BINARY_ASSOCIATION>
	<BINARY_ASSOCIATION NAME="ENFANT/MARRAINE">
		<A ENTITY_NAME="PERSONNE" ROLE="ENFANT"/>
		<B ENTITY_NAME="PERSONNE" ROLE="MARRAINE"/>
		<AtoB MIN="0" MAX="1" TRAVERSABLE="true" MEANING="MARRAINE"/>
		<BtoA MIN="0" MAX="INFINITY" ORDERED="true" TRAVERSABLE="false" MEANING="EST LA MARRAINE DE"/>
	</BINARY_ASSOCIATION>
	<BINARY_ASSOCIATION NAME="LIEU_NAISSANCE">
		<A ENTITY_NAME="PERSONNE" ROLE="BEBE"/>
		<B ENTITY_NAME="LIEU" ROLE="LIEU_NAISSANCE"/>
		<AtoB MIN="0" MAX="1" TRAVERSABLE="true" MEANING="LIEU_NAISSANCE"/>
		<BtoA MIN="0" MAX="INFINITY" ORDERED="false" TRAVERSABLE="false" MEANING="PERSONNES_NEES"/>
	</BINARY_ASSOCIATION>
	<BINARY_ASSOCIATION NAME="LIEU_DECES">
		<A ENTITY_NAME="PERSONNE" ROLE="DECEDE"/>
		<B ENTITY_NAME="LIEU" ROLE="LIEU_DECES"/>
		<AtoB MIN="0" MAX="1" TRAVERSABLE="true" MEANING="LIEU_DECES"/>
		<BtoA MIN="0" MAX="INFINITY" ORDERED="false" TRAVERSABLE="false" MEANING="PERSONNES_DECEDEES"/>
	</BINARY_ASSOCIATION>
</MODEL>
