<?xml version="1.0" encoding="UTF-8"?>
<!--<!DOCTYPE MODEL SYSTEM 'delta/leo/model/Model.dtd'>-->
<MODEL NAME="HOLLYWOOD">
	<ENTITY NAME="MOVIE">
	</ENTITY>
	<ENTITY NAME="PERSON">
	</ENTITY>
	<BINARY_ASSOCIATION NAME="ACTOR/MOVIE">
		<A ENTITY_NAME="PERSON" ROLE="ACTOR"/>
		<B ENTITY_NAME="MOVIE" ROLE="MOVIE"/>
		<AtoB MIN="0" MAX="INFINITY" ORDERED="true" TRAVERSABLE="true" MEANING="PLAYS IN"/>
		<BtoA MIN="0" MAX="INFINITY" ORDERED="false" TRAVERSABLE="true" MEANING="CASTING"/>
	</BINARY_ASSOCIATION>
</MODEL>
